,Text,Speaker,Season
1338, Spooge? Not Mad Dog? Not Diesel? So lemme get this straight you got jacked by a guy named Spooge?,Jesse,2
1339, The game has changed yo. This is our city alright? All of it. The whole damn place. Our territory. Were staking our claim. Yo we sell when we want where we want. Were gonna be kings understand? Well Im gonna be king and you guys will be like princes or dukes or something.,Jesse,2
1340, Then make the right choice Walt. Youre not the only one it affects. What about your son? Dont you wanna see your daughter grow up? I just...,Skyler,1
1341, Yeah yeah I got a bunch of em!,Hank,2
1342, Who cares as long as its our competitors who believe it and not the police? -Oh my--,Walter,2
1343, Okay. So they got names?,Hank,3
1344, Yeah. I would waste him too yo.,Hank,4
1345, Yeah three shots or I dunno two?,Jesse,5
1346, Spooge? Not Mad Dog? Not Diesel? So lemme get this straight you got jacked by a guy named Spooge?,Jesse,4
1347, You know what? Screw this. Im walking. You can come or not. Wheres my other shoe?,Hank,4
1348, What do you mean? To like a distributor?,Hank,1
1349, Hey hey! What the hell yo? I thought this was just a wake-up call!,Hank,3
1350, Dont shoot!,Hank,4
1351, Mr. White? Are you smoking weed? Oh my God! Wait a minute is that my weed? What the hell man? Make yourself at home why dont you?,Jesse,1
1352, Yeah? Well you dont get to vote.,Jesse,4
1353, What you said in the desert I get it. What you meant. I deserve whatever happens.,Jesse,4
1354, Whats changed Jesse?,Walter,4
1355, You got the C man alright? Youre as good as checked out already okay? You should be all like sacrificial jumping on a grenade yo. Just...,Jesse,3
1356, Hey hey! What the hell yo? I thought this was just a wake-up call!,Jesse,3
1357, Uh yeah?,Hank,3
1358, This is...This is like a...a non-criminals idea of a drug meet. This is like Oh I saw this in a movie. Ooh look at me.,Hank,1
1359,,Walter,5
1360, Eighty percent.,Walter,4
1361, How much did you get for the deal?,Jesse,2
1362,,Skyler,4
1363, I have this coming.,Walter,3
1364, Thats awesome! Serious? Thats...thats...thats great man! My aunt she never...I mean yknow at your stage I didnt even think that could happen.,Hank,2
1365, Thats Backwardo. Oh wait no actually I changed it to Rewindo. Anyways he goes backwards. He can make everything go in reverse.,Hank,2
1366, You got the C man alright? Youre as good as checked out already okay? You should be all like sacrificial jumping on a grenade yo. Just...,Hank,2
1367, Adjusting for inflation – good state college – adjusting for inflation say $45000 a year two kids four years of college...$360000. Remaining mortgage on the home $107000. Home equity line $30000 thats $137000. Cost of living food clothing utilities – say two grand a month? I mean that should put a dent in it anyway. 24K a year provides for say ten years. Thats $240000 plus 360 plus 137...737. $737000 thats what I need. That is what I need. You and I both clear about 70 grand a week. Thats only ten and a half more weeks. Call it eleven. Eleven more drug deals and always in a public place from now on. Its doable. Definitely doable.,Walter,3
1368, No.,Walter,4
1369,,Hank,3
1370, Whatever it is Im afraid to know.,Skyler,3
1371, Since when?,Walter,2
1372, Okay now we...I mean what do we...Oh! Hey I almost forgot. [Jesse hands Walter a paper bag filled with money] So how do you want to...yknow...proceed in light of this kickass news?,Jesse,3
1373, No thanks for caring.,Hank,5
1374, Funyuns are awesome.,Jesse,4
1375, You wanna know how much Ive got left? After completing my first round of treatment and financing the worlds most expensive alibi? Zero. Zip. Nothing.,Walter,2
1376,,Hank,2
1377, Damn...,Hank,5
1378, Yo Im really sorry okay?,Hank,3
1379, Oh cmon this is bullshit! I mean look at this dude alright? He doesnt even know what planet hes living on!,Hank,3
1380, Whatd you do huh? Shes lying there dying and where the hell are you?,Hank,2
1381, But then it got me thinking again about the all the strange behavior. Not the least of which was the disappearance. Out of my mind with worry calling hospitals checking the morgue. Your fugue state? I had to believe that didnt I? I had to find a way. I mean who would lie about such a thing?,Skyler,2
1382, What are we building?,Jesse,4
1383, Oh cmon this is bullshit! I mean look at this dude alright? He doesnt even know what planet hes living on!,Hank,5
1384, Cyber-begging thats all that is. Just rattling a little tin cup to the entire world.,Walter,3
1385, Rent yo. Responsibilities and what not. Ive already lost more than Ive made and I am tired of dicking around out here. [takes a sip of his beer],Jesse,2
1386, We tried to poison you. We tried to poison you because you are an insane degenerate piece of filth and you deserve to die.,Walter,5
1387, [laughs weakly] Something... something scientific right...,Walter,4
1388, Look I know some guys alright? I can create a network. Look we control production and distribution. That way we stay off the front lines while moving some serious glass. I mean the point here is to make money right? Sky high stacks!,Jesse,2
1389, You know what? Screw this. Im walking. You can come or not. Wheres my other shoe?,Hank,2
1390, Well were set. Boys are ready. Gonna make some mad cheddar yo. [Walter looks at Jesse] Cheddar Mr. White. Fat stacks. Dead Presidents. Cash money. Were gonna own this city.,Hank,3
1391, What?,Hank,5
1392, So you do have a plan! Yeah Mr. White! Yeah science!,Jesse,1
1393, Yeah damn straight. Know why? Cause we do things my way this time or I walk! You need me more than I need you...Walt.,Hank,4
1394, [kicks a toolbox toward Jesse] Brake pads!,Walter,3
1395, What? What does that even mean?,Hank,4
1396, Dude! No way!,Hank,5
1397, Im taking the baby with me. Marie will pick up Walter Jr. from school. You will have the house to yourself for two days. I want you to pack your things and leave.,Skyler,5
1398, Thats Backwardo. Oh wait no actually I changed it to Rewindo. Anyways he goes backwards. He can make everything go in reverse.,Jesse,5
1399, I deserve this.,Hank,3
1400, You know what? Screw this. Im walking. You can come or not. Wheres my other shoe?,Jesse,4
1401, More for me.,Hank,3
1402, Nothing. Im sorry I just...,Hank,2
1403, So whatre you saying? Like I shot someone with like a gun?,Hank,4
1404, Adjusting for inflation – good state college – adjusting for inflation say $45000 a year two kids four years of college...$360000. Remaining mortgage on the home $107000. Home equity line $30000 thats $137000. Cost of living food clothing utilities – say two grand a month? I mean that should put a dent in it anyway. 24K a year provides for say ten years. Thats $240000 plus 360 plus 137...737. $737000 thats what I need. That is what I need. You and I both clear about 70 grand a week. Thats only ten and a half more weeks. Call it eleven. Eleven more drug deals and always in a public place from now on. Its doable. Definitely doable.,Walter,2
1405, [kicking Tuco into the shallow pit] Whos the bitch now?!,Hank,2
1406, No please no! God please no! Oh God I dont wanna die!,Jesse,5
1407, Okay now we...I mean what do we...Oh! Hey I almost forgot. [Jesse hands Walter a paper bag filled with money] So how do you want to...yknow...proceed in light of this kickass news?,Hank,5
1408, Well take our time and stay cautious. Sell off what we have and then...well then I guess Im done.,Walter,3
1409, How significant?,Hank,4
1410, I dont even know what...,Jesse,2
1411, It was my hard work. My research. And you and Elliott made millions off it.,Walter,5
1412, Thats not how it happened.,Jesse,4
1413, That must be it!,Walter,4
1414, No please no! God please no! Oh God I dont wanna die!,Hank,2
1415, Actually its not as bad as it sounds. Its a fairly common occurrence. Easily treated. In fact the news is all good.,Walter,2
1416, Were not going to need pseudoephedrine. Were going to make phenylacetone in a tube furnace then were going to use reductive amination to yield methamphetamine. Four pounds.,Walter,1
1417, Its clean.,Jesse,2
1418, [sarcastically] Ooh this is the guy youd hire.,Walter,5
1419, [holding the bag threateningly over his head] You wanna find out?,Walter,1
1420, You know what? Screw this. Im walking. You can come or not. Wheres my other shoe?,Jesse,5
1421, I dont even know what...,Hank,3
1422, When? Skyler I was medicated. I mean I could have said the world was flat.,Walter,2
1423, Alright tell you what. Both of you pull it out your butts right now or I go grab a flashlight and some pliers and go exploring.,Hank,2
1424, Okay... [gets up],Walter,5
1425, Is this a five or an S?,Hank,4
1426, Right before your surgery I asked if you had packed your cell phone and you said Which one?,Skyler,5
1427, Why would I do that?,Walter,4
1428, Prove it. Pee in that.,Walter,2
1429, [starts to head outside] Solid zinc...,Jesse,4
1430,,Jesse,5
1431, We got to be Tuco. Alright cut out the middle man run our own game.,Hank,2
1432, How significant?,Hank,3
1433, Sooner or later this is gonna happen. If you want your exponential growth guys are gonna get busted. Simple as that.,Hank,3
1434, Are you actually this stupid...,Walter,2
1435, I have it coming. I deserve this.,Walter,5
1436, Conjecture yes. And conjecture isnt helping.,Walter,2
1437, Snap out of it. All right first off everything you did you did for your family. Right?,Jesse,3
1438, Why are you here?,Hank,1
1439, No please no! God please no! Oh God I dont wanna die!,Hank,5
1440, Tuco. Tuco hey why dont we just all relax huh?,Walter,1
1441, I have it coming. I deserve this.,Walter,3
1442, What? You kidding me? This is the guy you want. This is the guy Id hire.,Jesse,2
1443, Are you actually this stupid...,Walter,5
1444, [in a calm tone] - Then what do you suggest we do? I dont think either of us are eager to jump into bed with another Tuco.,Walter,5
1445, Oh God thats beautifully done.,Walter,5
1446, So we can cook.,Walter,3
1447, I mean two would probably work I guess yeah.,Jesse,5
1448, No no it cannot be blind luck or some imaginary relative who saves us. No I earned that money. Me! And now my son created his own website – SaveWalterWhite.com. Soliciting anonymous donations. Do you have any idea how that makes me feel?,Walter,5
1449, Yeah yeah yeah thats it. While you were cooking you know he was watching one of those uh those uh telenovels yknow with all those ripe honeys on it? Yknow he was really into it. I told you not to change the channel man! Yknow dude needs his eye candy. Thats it!,Hank,5
1450, Three entire bags of Funyuns?,Walter,5
1451, What?,Hank,4
1452, Look I know some guys alright? I can create a network. Look we control production and distribution. That way we stay off the front lines while moving some serious glass. I mean the point here is to make money right? Sky high stacks!,Jesse,4
1453, Could you just state the facts?,Walter,2
1454, But then it got me thinking again about the all the strange behavior. Not the least of which was the disappearance. Out of my mind with worry calling hospitals checking the morgue. Your fugue state? I had to believe that didnt I? I had to find a way. I mean who would lie about such a thing?,Skyler,4
1455, No why dont you grow up mom? Jenny wanted me here! Alright I was the one who took care of her. Alright I took her to her appointments and made her lunch everyday. I earned this!,Hank,2
1456, The man who invented the diamond. All right. H. Tracy Hall – write this name down. Dr. Hall invented the first reproducible process for making synthetic diamonds. I mean this is way back in the 50s. Now today synthetic diamonds are used in oil drilling electronics multi-billion dollar industries. Now at the time Dr. Hall worked for General Electric and he made them a fortune. I mean incalculable. You want to know how GE rewarded Dr. Hall? A $10 U.S. savings bond. [Walt becomes angry but calms himself] Anyway a savings bond printed on carbon-based paper paid to a carbon-based man for something he made out of...carbon.,Walter,4
1457, Jeez.,Hank,1
1458,,Skyler,3
1459, What?,Walter,3
1460, Oh cmon this is bullshit! I mean look at this dude alright? He doesnt even know what planet hes living on!,Jesse,4
1461, Im going to Hank and Maries for the weekend.,Skyler,2
1462, [sarcastically] Ooh this is the guy youd hire.,Walter,2
1463, So you plan to uh ice Gonzo like...future tense?,Hank,5
1464, Did he mention my name?,Walter,4
1465, My rainy day fund $68000 okay? Cue ball son of a bitch laughed in my face. Now I got like eighty bucks to my name.,Jesse,2
1466, I woke up. I found her. Thats all I know.,Hank,2
1467, You have a good rest of your life kid.,Hank,2
1468, I deserve this.,Hank,5
1469, Wanna cook?,Walter,1
1470, No why dont you grow up mom? Jenny wanted me here! Alright I was the one who took care of her. Alright I took her to her appointments and made her lunch everyday. I earned this!,Jesse,2
1471, [starts to head outside] Solid zinc...,Hank,5
1472, I woke up. I found her. Thats all I know.,Jesse,3
1473, Whatd you do huh? Shes lying there dying and where the hell are you?,Hank,5
1474, But first things first we gotta get more dealers yknow foot soldiers alright? Now theyll be working for you youre working for me and Im working for you. You follow me? Layered like nachos. Exponential growth. Thats success with a capital S.,Hank,4
1475, Well take our time and stay cautious. Sell off what we have and then...well then I guess Im done.,Walter,2
1476, Can he get it running again?,Walter,5
1477, Mr. White you kicked its ass yo! [Walter motions for Jesse to quiet down] No! You must be so psyched!,Jesse,2
1478, Oh well heil Hitler bitch! And let me tell you something else. We flipped a coin okay? You and me. You and me! Coin flip is sacred! Your job is waiting for you in that basement as per the coin!,Hank,1
1479, Uh yeah?,Jesse,4
1480, I remember oh I remember. That you cook I sell. That was the division of labor when we started all this. And thats exactly how we should have kept it! Cause I sure as hell didnt find myself locked in a trunk or on my knees with a GUN to my head before your greedy old ass came along alright?,Hank,2
1481, No please no! God please no! Oh God I dont wanna die!,Jesse,2
1482, What is that? Conjecture? Are you basing that on that hes got a normal healthy brain or something? Did you not see him beat a dude to death for like nothing? And that way–that way he just kept staring at us. Saying Youre done. Youre done?! You wanna know what that means? I will tell you what that means! That means exactly how it sounds yo! Alright we are witnesses we are loose ends! Right now Tucos thinking Yeah hey they cook good meth but can I trust them? What happens when he decides no?,Hank,5
1483, Partners in what? What exactly do you do here Ive been meaning to ask. Because Im the producer right? I cook. But from what I can tell you are just a drug addict! You are a pathetic junkie too stupid to understand and follow simple rudimentary instructions! Too stupid to–,Walter,4
1484, What you said in the desert I get it. What you meant. I deserve whatever happens.,Hank,4
1485, So youre going to what? Snort meth off a bowie knife? Youre gonna beat your homies to death when they dis you?,Walter,4
1486, You wanna know how much Ive got left? After completing my first round of treatment and financing the worlds most expensive alibi? Zero. Zip. Nothing.,Walter,4
1487, Oh thank God!,Jesse,3
1488, Dude! No way!,Hank,3
1489, So this is what? Blackmail?,Walter,5
1490, Oh we are dead. Dead men! Muerto or muerte or however the hell you...Jesus...,Jesse,3
1491, No he just walks backwards.,Jesse,2
1492, Is New Zealand part of Australia?,Jesse,2
1493, Let him bleed.,Walter,2
1494, 3-A.,Walter,1
1495, Hey! Bring. The bottle. Back.,Walter,3
1496, in rushing tone] I woke up. I found her. Thats all I know. I woke up. I found her. Thats all I know.,Jesse,2
1497, I woke up. I found her. Thats all I know.,Jesse,4
1498, Whatd you do huh? Shes lying there dying and where the hell are you?,Jesse,4
1499, Thats not how it happened.,Jesse,3
1500, What would you know about me Gretchen? What would your presumption about me be exactly? That I should go begging for your charity and you waving your checkbook around like some magic wand is going to make me forget how you and Elliott – how you and Elliott – cut me out?,Walter,5
1501, Fulminated mercury and a little tweak of chemistry.,Walter,1
1502, Its clean.,Hank,4
1503, I remember oh I remember. That you cook I sell. That was the division of labor when we started all this. And thats exactly how we should have kept it! Cause I sure as hell didnt find myself locked in a trunk or on my knees with a GUN to my head before your greedy old ass came along alright?,Hank,3
1504, Yo why would you want this lame-ass job anyway? I mean no offense.,Hank,1
1505, How much did you get for the deal?,Hank,2
1506, Oh-ho!,Hank,4
1507, Tuco cmon hey hes theres clearly some dementia. Hes not lucid.,Walter,5
1508, What you said in the desert I get it. What you meant. I deserve whatever happens.,Jesse,3
1509, Well take our time and stay cautious. Sell off what we have and then...well then I guess Im done.,Walter,4
1510, Have a seat. Please. [Gus sits down across from Walt] I would like to know why you wouldnt meet with me yesterday.,Walter,4
1511, What are we building?,Hank,3
1512, So whatre you saying? Like I shot someone with like a gun?,Jesse,2
1513, I dont suppose you could buy two bins... [makes a sawing motion] Legs in one torso in the other?,Walter,1
1514, Your freaking wife told me when she was here all up on my shit! Yeah thats right. She almost caught me moving Emilio! Good job wearing the pants in the family! And why did you go telling her I was selling you weed?,Hank,1
1515, I want you to handle it.,Walter,3
1516, They sweated me plenty but they finally cut me loose. So you getting out of there?,Hank,3
1517, Your half? There is no your half of the money! There is only my all of it do you understand?! Why why should I be penalized because of your sloppiness?!,Walter,5
1518, Prove it. Pee in that.,Walter,3
1519, How about something with some protein maybe? Something green huh? How are you even alive?,Walter,5
1520, $1.2 million.,Walter,3
1521, What if Skyler had seen you huh? What then? What was the plan then genius? Hm?,Walter,4
1522, Yeah thats the thing yknow? Your scumbag brother-in-law took my rainy day fund.,Jesse,4
1523, What?,Hank,3
1524, I dont know.,Jesse,4
1525, Alright fine facts in. Fact A my phone rang like eight times last night. Dead air hang-ups every time. Second fact? Like three in the morning I saw that black Caddy of his cruising my neighborhood. No headlights.,Hank,5
1526, What is wrong with you? Why are you blue? Aw Jesus...,Walter,2
1527, The dude needs his eye candy ...,Jesse,2
1528, You are joking right? If I gave you that money you would be dead inside of a week.,Walter,4
1529, How gay are you seriously?,Jesse,2
1530, No I am not willing to do that!,Walter,3
1531, What do you mean? To like a distributor?,Jesse,1
1532, Yeah damn straight. Know why? Cause we do things my way this time or I walk! You need me more than I need you...Walt.,Hank,2
1533, Hey I said I was sorry alright? I just need my half of the money and Ill go!,Hank,2
1534, Youre damn right.,Walter,5
1535, [kicking Tuco into the shallow pit] Whos the bitch now?!,Jesse,3
1536, I told you not to change the channel Man!,Hank,3
1537, Okay now we...I mean what do we...Oh! Hey I almost forgot. [Jesse hands Walter a paper bag filled with money] So how do you want to...yknow...proceed in light of this kickass news?,Jesse,4
1538, What are we building?,Hank,4
1539, Its a whole lot of cheddar.,Jesse,4
1540, Who said anything about you?,Jesse,3
1541, Dont shoot!,Jesse,5
1542, [in a calm tone] - Then what do you suggest we do? I dont think either of us are eager to jump into bed with another Tuco.,Walter,3
1543, Snap out of it. All right first off everything you did you did for your family. Right?,Jesse,2
1544, God. This entire process has just been so... Its always been one step forward and two steps back. We need your help.,Walter,5
1545, No mom mom mom! Hey where am I supposed to go?,Hank,2
1546, I deserve this.,Hank,2
1547, This is conjecture?,Jesse,4
1548, 38 pounds. Ready to go at a moments notice. [Gus gets up] Will I hear from you?,Walter,5
1549, You got the C man alright? Youre as good as checked out already okay? You should be all like sacrificial jumping on a grenade yo. Just...,Jesse,2
1550, Smoking marijuana eating Cheetos and masturbating do not constitute plans in my book.,Walter,3
1551, Ooooh wire.,Jesse,5
1552, Well theres the money discussion. $90000 out of pocket. Maybe more.,Walter,1
1553, So this is what? Blackmail?,Walter,3
1554, So whatre you saying? Like I shot someone with like a gun?,Hank,3
1555, [kicks a toolbox toward Jesse] Brake pads!,Walter,4
1556, Yeah. I would waste him too yo.,Hank,2
1557, What is that? Conjecture? Are you basing that on that hes got a normal healthy brain or something? Did you not see him beat a dude to death for like nothing? And that way–that way he just kept staring at us. Saying Youre done. Youre done?! You wanna know what that means? I will tell you what that means! That means exactly how it sounds yo! Alright we are witnesses we are loose ends! Right now Tucos thinking Yeah hey they cook good meth but can I trust them? What happens when he decides no?,Hank,2
1558, You still wanna cook? Seriously?,Jesse,4
1559, Tuco? no man ... no more Taco... I got bills man.,Jesse,3
1560, What I came to realize is that fear thats the worst of it. Thats the real enemy. So get up. Get out in the real world. And you kick that bastard as hard as you can right in the teeth.,Walter,5
1561, [to Skyler] Our son doesnt know who Boz Scaggs is. We have failed as parents.,Walter,3
1562, No why dont you grow up mom? Jenny wanted me here! Alright I was the one who took care of her. Alright I took her to her appointments and made her lunch everyday. I earned this!,Hank,5
1563,,Hank,5
1564, You are always the picture of innocence.,Walter,4
1565, Thats not how it happened.,Jesse,5
1566, But first things first we gotta get more dealers yknow foot soldiers alright? Now theyll be working for you youre working for me and Im working for you. You follow me? Layered like nachos. Exponential growth. Thats success with a capital S.,Hank,3
1567, Yo I waited til the ball buster left. I mean no offense.,Jesse,1
1568, I dont even know what...,Jesse,3
1569, It may be blue but its the bomb.,Jesse,1
1570, Your what? What is that?,Walter,5
1571, How did you find me?,Walter,4
1572, Can he get it running again?,Walter,2
1573, How much what?,Walter,2
1574, No no it cannot be blind luck or some imaginary relative who saves us. No I earned that money. Me! And now my son created his own website – SaveWalterWhite.com. Soliciting anonymous donations. Do you have any idea how that makes me feel?,Walter,4
1575, I dont even know what...,Jesse,5
1576, Tell you what?,Walter,5
1577, With whom? Who am I having an affair with?,Walter,5
1578, Hank has offered to help since you shouldnt be doing any heavy lifting.,Skyler,3
1579, Okay. So they got names?,Hank,4
1580, Hey...no...no man. No...,Hank,4
1581, How significant?,Hank,5
1582, All right all right...,Hank,3
1583, Oh I know. I know youre not. Cause I asked her. It really took me forever to get in touch with her. She was ducking my calls for weeks. So I finally left a message What exactly is going on between you and my husband? I thought thatd get her attention and it did. So she called me back and she finally told me. The money? For your treatment? Gretchen and Elliott didnt give you a dime. They paid for nothing. You refused every offer they made you but that didnt make sense because I checked with Delcavoli in the hospital and not including your surgery were nearly paid up. Over $100000. Out of where? Out of thin air? But then I called your mother. Yeah. Thanks for that too. But I thought yknow maybe she has some money that I dont know about? Maybe she contributed? Its possible. It turns out that not only is the money not your mother she didnt even know that you have cancer. You never went to see her. I dropped you at the airport I picked you up you were gone for four days and yet she swears that you were never there. Lies on top of lies on top of lies.,Skyler,5
1584, [starts to head outside] Solid zinc...,Hank,2
1585, Ooooh wire.,Hank,3
1586, Im taking the baby with me. Marie will pick up Walter Jr. from school. You will have the house to yourself for two days. I want you to pack your things and leave.,Skyler,4
1587, The moment I do are you gonna stick me with that broken piece of plate?,Walter,1
1588, Yeah? Well you dont get to vote.,Hank,4
1589, What if Skyler had seen you huh? What then? What was the plan then genius? Hm?,Walter,2
1590, And now what? You decided to oh I dont know make your eldest son homeless? Wow great family mom!,Jesse,4
1591, I dont even know what...,Hank,5
1592, Whats it feel like?,Jesse,3
1593, Of course. I am.,Walter,4
1594, Yeah thats the thing yknow? Your scumbag brother-in-law took my rainy day fund.,Hank,3
1595, Because youre a liar Walt. Two cell phones after all.,Skyler,3
1596, No wonder.,Walter,1
1597, Not really.,Walter,1
1598, Spooge? Not Mad Dog? Not Diesel? So lemme get this straight you got jacked by a guy named Spooge?,Jesse,5
1599, [squints eyes at Jesse] Youve got bills?,Walter,4
1600, I dont know.,Jesse,2
1601, Okay can you at least tell me why?,Walter,2
1602, And–and–and bring me... brake pads! The front wheels should have discs. Take them off and bring them to me.,Walter,5
1603, I dont think I am.,Walter,2
1604, Heisenberg.,Walter,1
1605, Because he does what I say. Because I can trust him.,Walter,3
