,Text,Speaker,Season
0, [in a calm tone] - Then what do you suggest we do? I dont think either of us are eager to jump into bed with another Tuco.,Walter,4
1, Look you remember Emilio? Kay this dude got Emilio off like twice. Kay both times they had him dead to rights yo and then poof. Dudes like Houdini. Seriously when the going gets tough you dont want a criminal lawyer all right? You want a criminal lawyer. You know what Im saying?,Jesse,5
2, You are joking right? If I gave you that money you would be dead inside of a week.,Walter,3
3, Yeah damn straight. Know why? Cause we do things my way this time or I walk! You need me more than I need you...Walt.,Jesse,5
4, Stay out of my territory.,Walter,3
5, The shit you cook is shit. I saw your set-up. Ridiculous. You and I will not make garbage. We will produce a chemically pure and stable product that performs as advertised. No adulterants. No baby formula. No chili powder.,Walter,1
6, You know what? Screw this. Im walking. You can come or not. Wheres my other shoe?,Hank,5
7, Jesus I dont wanna die! NO!,Hank,2
8, And perhaps I was overly ambitious. In any case its not gonna happen that way anymore.,Walter,3
9, I need support. Me the almost forty year old pregnant woman with the surprise baby on the way. And the husband with lung cancer who disappears for hours on end and I dont know where he goes and he barely even speaks to me anymore. With the moody son who does the same thing. And the overdrawn checking account. And the lukewarm water heater that leaks rusty looking crap and is rotting out the floor of the utility closet and we cant even afford to fix it! But oh I see! Now Im supposed to go Hank please what can I possibly do to further benefit my spoiled kleptomaniac bitch sister who somehow always manages to be the center of attention? Cause God knows shes the one with the really important problems!,Skyler,5
10, Yo man look Im off the heroin. I didnt even like it anyway it made me sick. And the meth yknow I could take it or leave it. Im clean Mr. White. For real.,Jesse,4
11, Oh thank God!,Hank,4
12, Nothing. Im sorry I just...,Hank,3
13, This is conjecture.,Walter,4
14, What are we building?,Hank,5
15, Snap out of it. All right first off everything you did you did for your family. Right?,Hank,3
16, Yeah? Jesus how the hell do you spell street wrong? S-T-R-E-A-T?,Hank,2
17, Its a whole lot of cheddar.,Hank,5
18, Whats it feel like?,Jesse,2
19, How about something with some protein maybe? Something green huh? How are you even alive?,Walter,3
20, Man cmon!,Jesse,3
21, Jesse look at me you are a blow fish.,Walter,4
22, Yo you wanna go shopping go do it yourself alright? I got plans.,Jesse,3
23, Badgers cousin took it to his garage. Its safe.,Hank,2
24, Jesus I dont wanna die! NO!,Jesse,5
25, What part of no contact didnt you understand?,Walter,3
26, Dont shoot!,Jesse,2
27, Okay can you at least tell me why?,Walter,3
28, The dude needs his eye candy ...,Hank,2
29, Hank has offered to help since you shouldnt be doing any heavy lifting.,Skyler,5
30, Ha!,Walter,5
31, Its clean.,Jesse,5
32, Fuck you.,Walter,3
33, Well my guess was Gretchen Schwartz. Something was going on between you. I just knew.,Skyler,5
34, Look I dont know what you think youre doing here Mr. White. I mean if youre planning on giving me some bullshit about getting right with Jesus by turning myself in...,Jesse,1
35, I dont understand. What exactly are you offering to do for me?,Walter,3
36, No why dont you grow up mom? Jenny wanted me here! Alright I was the one who took care of her. Alright I took her to her appointments and made her lunch everyday. I earned this!,Jesse,5
37, [kicking Tuco into the shallow pit] Whos the bitch now?!,Jesse,5
38, No thanks for caring.,Jesse,2
39, Who said anything about you?,Hank,2
40, No mom mom mom! Hey where am I supposed to go?,Jesse,3
41, The man who invented the diamond. All right. H. Tracy Hall – write this name down. Dr. Hall invented the first reproducible process for making synthetic diamonds. I mean this is way back in the 50s. Now today synthetic diamonds are used in oil drilling electronics multi-billion dollar industries. Now at the time Dr. Hall worked for General Electric and he made them a fortune. I mean incalculable. You want to know how GE rewarded Dr. Hall? A $10 U.S. savings bond. [Walt becomes angry but calms himself] Anyway a savings bond printed on carbon-based paper paid to a carbon-based man for something he made out of...carbon.,Walter,2
42, Whats changed Jesse?,Walter,5
43, You got something for me?,Jesse,5
44, What are you talking about?,Jesse,3
45, Yo man look Im off the heroin. I didnt even like it anyway it made me sick. And the meth yknow I could take it or leave it. Im clean Mr. White. For real.,Hank,2
46, I have it coming. I deserve this.,Walter,4
47, Okay dont talk Walt! Shut up and say something that isnt complete bullshit! You want to know what you have to do? You have to tell me whats really going on right now – today. No more excuses no more apologies no more of these...these obvious desperate breakfasts! You dont wanna lose contact with me Walt? Good. Then tell me. Now.,Skyler,3
48, Ive got a better idea.,Walter,5
49, Jesus I dont wanna die! NO!,Jesse,3
50, And now what? You decided to oh I dont know make your eldest son homeless? Wow great family mom!,Jesse,2
51, We used a different chemical process but it is every bit as pure.,Walter,1
52, Three entire bags of Funyuns?,Walter,4
53, We got to be Tuco. Alright cut out the middle man run our own game.,Hank,5
54, Are you out of your mind? What are you like sixteen years old? Your brother-in-law is a DEA agent! What is wrong with you?,Skyler,1
55, $1.2 million.,Walter,4
56, Oh I mean...,Jesse,5
57, Yeah. Thats pretty much the size of it.,Walter,4
58, Whats changed Jesse?,Walter,3
59, Yeah? Well you dont get to vote.,Hank,2
60, I sat here yesterday waiting to meet with someone. I believe that person was you.,Walter,4
61, Apparently its all over town. Somebody crossed you you got angry you crushed their skull with an ATM machine.,Walter,2
62, Yo Im really sorry okay?,Hank,4
63, Yo you wanna go shopping go do it yourself alright? I got plans.,Jesse,5
64, What the f...?,Walter,2
65, Yeah yeah this is gonna help big time with that. BITCH!,Hank,5
66, What?,Jesse,1
67, Im going to Hank and Maries for the weekend.,Skyler,3
68, No he just walks backwards.,Hank,5
69, [to Skyler] Our son doesnt know who Boz Scaggs is. We have failed as parents.,Walter,4
70, You need to cut out all your loser crybaby crap right now and think of something scientific!,Jesse,3
71, High school was a long time ago. You aint Welcome Back Kotter so step off. No speeches.,Hank,1
72, What?,Jesse,2
73, Jesus I dont wanna die! NO!,Jesse,2
74, What part of no contact didnt you understand?,Walter,4
75, That must be it!,Walter,3
76, Okay.,Hank,3
77, Have a seat. Please. [Gus sits down across from Walt] I would like to know why you wouldnt meet with me yesterday.,Walter,2
78, What?,Jesse,4
79, The upshot is that I have radiation pneumonitis.,Walter,4
80, Look that is completely uncool alright? We agreed 50/50 partners!,Jesse,2
81, Yeah? Well you dont get to vote.,Hank,5
82, I got profile now yo. Dont you get that? DEAs up my ass. [takes a sip of his beer] No Im not exposing myself to that level of risk for chump change. - No way.,Hank,3
83, I have this coming.,Walter,2
84, $480000. Sauls cut is 20%.,Walter,2
85, I want you gone by Monday morning. I want...I want you gone.,Skyler,4
86, You got a brother in the goddamned DEA?!,Hank,1
87, And now what shall we use to conduct this beautiful current with hm? What one particular element comes to mind hm? [Walter holds up a copper wire] Hmm?,Walter,4
88, Did he mention my name?,Walter,2
89, ...to come to my house and park on my street driving this vehicle? I mean what the hell is wrong with you?! Im really asking!,Walter,4
90, Man cmon!,Hank,5
91, Ive got a better idea.,Walter,3
92, We need a plan.,Walter,3
93, Crack him over the head with something? [Walter sarcastically holds up a fly swatter],Walter,4
94, You know what I think? I think you accidentally told the truth.,Skyler,5
95, The dude needs his eye candy ...,Jesse,4
96, Who said anything about you?,Hank,3
97, Yeah. I would waste him too yo.,Hank,3
98, The dude needs his eye candy ...,Hank,4
99, Okay now we...I mean what do we...Oh! Hey I almost forgot. [Jesse hands Walter a paper bag filled with money] So how do you want to...yknow...proceed in light of this kickass news?,Hank,2
100, Of course. I am.,Walter,5
101, Well were set. Boys are ready. Gonna make some mad cheddar yo. [Walter looks at Jesse] Cheddar Mr. White. Fat stacks. Dead Presidents. Cash money. Were gonna own this city.,Jesse,3
102, Wait wait what does he know? Does he know its your money?,Walter,5
103, Your what? What is that?,Walter,3
104, I told you not to change the channel Man!,Jesse,3
105, So you plan to uh ice Gonzo like...future tense?,Hank,2
106, Tuco? no man ... no more Taco... I got bills man.,Hank,2
107, Yeah damn straight. Know why? Cause we do things my way this time or I walk! You need me more than I need you...Walt.,Hank,3
108, Spooge? Not Mad Dog? Not Diesel? So lemme get this straight you got jacked by a guy named Spooge?,Jesse,3
109, You got something for me?,Hank,5
110, Hey! Bring. The bottle. Back.,Walter,5
111, Hey hey! What the hell yo? I thought this was just a wake-up call!,Hank,4
112, Oh my conjecture isnt helping?,Jesse,5
113, What is that? Conjecture? Are you basing that on that hes got a normal healthy brain or something? Did you not see him beat a dude to death for like nothing? And that way–that way he just kept staring at us. Saying Youre done. Youre done?! You wanna know what that means? I will tell you what that means! That means exactly how it sounds yo! Alright we are witnesses we are loose ends! Right now Tucos thinking Yeah hey they cook good meth but can I trust them? What happens when he decides no?,Jesse,2
114, What part of no contact didnt you understand?,Walter,5
115, Look I dont know what you think youre doing here Mr. White. I mean if youre planning on giving me some bullshit about getting right with Jesus by turning myself in...,Hank,1
116, Youre saying Tuco youre saying Gonzo is currently operating as a police informant as far as you know? [Tuco nods] Im very sorry to hear that. Thats disappointing.,Walter,5
117, Look you remember Emilio? Kay this dude got Emilio off like twice. Kay both times they had him dead to rights yo and then poof. Dudes like Houdini. Seriously when the going gets tough you dont want a criminal lawyer all right? You want a criminal lawyer. You know what Im saying?,Hank,5
118, What you said in the desert I get it. What you meant. I deserve whatever happens.,Hank,3
119, Skyler...,Walter,5
120, Who cares as long as its our competitors who believe it and not the police? -Oh my--,Walter,5
121, You uh...you want to cook crystal meth? You. You and uh...and me?,Jesse,1
122, Oh my conjecture isnt helping?,Jesse,4
123, Yeah? You shot an ounce? In a day and a half?,Hank,3
124, Hey...no...no man. No...,Jesse,3
125, What? Im just saying.,Hank,1
126, Where...did that come from? And why was it so damn good?,Skyler,1
127, You got something for me?,Jesse,2
128, Skyler...,Walter,3
129, I know but theres a problem.,Hank,2
130, My name is Walter Hartwell White. I live at 308 Negra Arroyo Lane Albuquerque New Mexico 87104. To all law enforcement entitles this is not an admission of guilt. I am speaking to my family now. Skyler you are the love of my life. I hope you know that. Walter Junior youre my big man. There are...there are going to be some things that youll come to learn about me in the next few days. I just want you to know that no–no matter how it may look I only had you in my heart. Goodbye.,Walter,1
131, Ive got a better idea.,Walter,4
132, Yes!,Jesse,2
133, The game has changed yo. This is our city alright? All of it. The whole damn place. Our territory. Were staking our claim. Yo we sell when we want where we want. Were gonna be kings understand? Well Im gonna be king and you guys will be like princes or dukes or something.,Hank,2
134, Okay now we...I mean what do we...Oh! Hey I almost forgot. [Jesse hands Walter a paper bag filled with money] So how do you want to...yknow...proceed in light of this kickass news?,Hank,4
135, Yeah. Thats pretty much the size of it.,Walter,5
136, ...A battery.,Walter,4
137, My son! My bottle! My house!,Walter,2
138, What are we building?,Jesse,3
139, [laughs weakly] Something... something scientific right...,Walter,2
140, I dont know. I swear I dont know. I no I it maybe it was I did change the channel on his TV but uh...,Walter,4
141, God. This entire process has just been so... Its always been one step forward and two steps back. We need your help.,Walter,4
142, You cant be serious. What the hell are you doing here?,Walter,1
143, All I ever managed to do was worry and disappoint them. And lie. Oh God the lies...I cant even...cant even keep them straight in my head anymore...,Walter,3
144, I mean two would probably work I guess yeah.,Hank,5
145, What?,Jesse,2
146, I dont understand. What exactly are you offering to do for me?,Walter,2
147, You tell me Skyler. You tell me exactly what it is you think Im lying about. What an affair? Im having an affair? Is that what you think?,Walter,4
148, Thats not how it happened.,Jesse,2
149, Weve had some extenuating circumstances.,Walter,2
150, I am awake.,Walter,1
151, God. This entire process has just been so... Its always been one step forward and two steps back. We need your help.,Walter,3
152, Short speech. You lost your partner today. Whats his name – Emilio? Emilio is going to prison. The DEA took all your money your lab. You got nothing. Square one. But you know the business. And I know the chemistry. Im thinking...maybe you and I could partner up.,Walter,1
153, They sweated me plenty but they finally cut me loose. So you getting out of there?,Jesse,4
154, So whats this stuff called again?,Hank,1
155, Oh what I can talk now? [pause] Fine! That goes double for me!,Hank,1
156, Your what? What is that?,Walter,2
157, ...A battery.,Walter,3
158, Yo you wanna go shopping go do it yourself alright? I got plans.,Hank,3
159, I woke up. I found her. Thats all I know.,Hank,3
160, Dude! No way!,Hank,4
161, Thats Backwardo. Oh wait no actually I changed it to Rewindo. Anyways he goes backwards. He can make everything go in reverse.,Jesse,3
162, No thanks for caring.,Jesse,5
163, Hey I said I was sorry alright? I just need my half of the money and Ill go!,Jesse,4
164, Like come on! Man youre smart! All right you made poison out of beans yo! Look weve got an entire lab right here. How about you take some of these chemicals and mix up some... some rocket fuel that way we could just send up a signal flare. Or you make some kind of robot to get us help... or a homing device... or building a battery... [Walts eyes snap open] Or what if we just take some stuff off of the RV and build it into something completely different? You know like a... like a dune buggy! And that way we could just dune buggy our... [Walt sits up] What? Hey... what is it? What?,Hank,3
165, I want you gone by Monday morning. I want...I want you gone.,Skyler,5
166, You mean good? You mean like good good? You mean like remission good?,Jesse,3
167, I woke up. I found her. Thats all I know.,Hank,5
168, No? Thats not the point?,Jesse,5
169, How about the basement?,Walter,4
170, Gather them. And–and–and washers and nuts and bolts and screws and whatever little pieces of metal we can think of that is galvanized – it has to be galvanized – or–or solid zinc.,Walter,2
171, Its weird is all okay? It doesnt compute. Listen if youve gone crazy or something; I mean if youve gone crazy or depressed Im just saying thats something I need to know about. Okay? I mean that affects me.,Hank,1
172, Were not charging enough.,Walter,2
173, Jesus I dont wanna die! NO!,Hank,5
174, What are we building?,Hank,2
175, Smoking marijuana eating Cheetos and masturbating do not constitute plans in my book.,Walter,4
176, What the f...?,Walter,5
177, Oh my conjecture isnt helping?,Hank,3
178, Since when?,Walter,5
179, You said it yourself.,Walter,5
180, Alright. You know what? [Jesse takes out a wad of cash] Four grand. Your share from selling that batch. Thats why Im here. Yeah thats right. I didnt smoke it all. [Jesse tosses the money into Walters pool and leaves],Jesse,1
181, Tuco cmon hey hes theres clearly some dementia. Hes not lucid.,Walter,4
182, Fuck you.,Walter,4
183, ...Copper.,Walter,5
184, So this is what? Blackmail?,Walter,4
185,,Skyler,1
186, Damn...,Jesse,2
187, 38 pounds. Ready to go at a moments notice. [Gus gets up] Will I hear from you?,Walter,3
188, What? What does that even mean?,Jesse,5
189, Pop pop pop? So three shots?,Walter,4
190, Man cmon!,Jesse,2
191, It was my hard work. My research. And you and Elliott made millions off it.,Walter,4
192, And perhaps I was overly ambitious. In any case its not gonna happen that way anymore.,Walter,2
193, Because youre a liar Walt. Two cell phones after all.,Skyler,5
194, What?,Jesse,3
195, So you plan to uh ice Gonzo like...future tense?,Hank,4
196, Yo its me. Is this a good time?,Hank,2
197, Im not out of the woods yet not by any stretch...but options is the word they keep bandying about.,Walter,5
198, in rushing tone] I woke up. I found her. Thats all I know. I woke up. I found her. Thats all I know.,Hank,3
199, All right all right...,Jesse,4
200, Oh God thats beautifully done.,Walter,2
201, You still wanna cook? Seriously?,Hank,2
202, $600000 each.,Jesse,4
203, They sweated me plenty but they finally cut me loose. So you getting out of there?,Hank,2
204, Hey...no...no man. No...,Hank,3
205, Not a clue.,Hank,1
206, The dude needs his eye candy ...,Hank,3
207, I dont know. To like...touch base.,Jesse,1
208, Right on little bro! Making mad in-roads with the business community.,Jesse,1
209, You got the C man alright? Youre as good as checked out already okay? You should be all like sacrificial jumping on a grenade yo. Just...,Jesse,5
210, My son! My bottle! My house!,Walter,3
211, You mean good? You mean like good good? You mean like remission good?,Hank,4
212, Nothing. Im sorry I just...,Jesse,4
213, You still wanna cook? Seriously?,Hank,4
214, Thats awesome! Serious? Thats...thats...thats great man! My aunt she never...I mean yknow at your stage I didnt even think that could happen.,Jesse,3
215, Honey we have been over this. Asked and answered right? There–,Walter,2
216, I woke up. I found her. Thats all I know.,Hank,2
217, Yeah? Jesus how the hell do you spell street wrong? S-T-R-E-A-T?,Jesse,3
218, I dont even know what...,Hank,4
219, Is this a five or an S?,Hank,3
220, Think think. Lets just bum rush him man. You know you crack him over the head with something and Ill go for his gun.,Jesse,4
221, I mean two would probably work I guess yeah.,Jesse,2
222, And now what? You decided to oh I dont know make your eldest son homeless? Wow great family mom!,Hank,2
223, A robot?,Hank,3
224, Yeah yeah yeah thats it. While you were cooking you know he was watching one of those uh those uh telenovels yknow with all those ripe honeys on it? Yknow he was really into it. I told you not to change the channel man! Yknow dude needs his eye candy. Thats it!,Jesse,3
225, Okay... [gets up],Walter,3
226, Alright say we set up one last sale this is providing he doesnt decide to waste us before then. Now every time we bring in a new batch he always tests the product right? So as his head is down yknow giving it a snort just pop pop pop!,Hank,3
227, What? What does that even mean?,Hank,3
228, A junkyard? Let me guess you picked this place?,Jesse,1
229, Im taking the baby with me. Marie will pick up Walter Jr. from school. You will have the house to yourself for two days. I want you to pack your things and leave.,Skyler,2
230, Everybody digs...the meth we cooked.,Walter,1
231, [in a calm tone] - Then what do you suggest we do? I dont think either of us are eager to jump into bed with another Tuco.,Walter,2
232, I deserve this.,Hank,4
233, What is wrong with you? Why are you blue? Aw Jesus...,Walter,4
234, Apparently its all over town. Somebody crossed you you got angry you crushed their skull with an ATM machine.,Walter,3
235,   ,Marie,4
236, I dont know. How about Taco Cabeza? Half the deals Ive ever done went down at Taco Cabeza. Nice and public. Open twenty-four hours. Nobody ever gets shot at Taco Cabeza. Hell why not the mall? You know wait at the Gap. Hey! Its time for the meet! You know Ill put down the flat-front khakis head on over grab an Orange Julius. Skip the part where psycho lunatic Tuco you know comes and steals my drugs and leaves me bleeding to death.,Jesse,1
237, No mom mom mom! Hey where am I supposed to go?,Hank,3
238, You mean good? You mean like good good? You mean like remission good?,Hank,3
239, A robot?,Jesse,2
240, Prick! And let me tell you something else this aint chemistry. This is art. Cooking is art. And the shit I cook is the bomb so dont be telling me.,Jesse,1
241, Okay... [gets up],Walter,4
242, What are we building?,Jesse,2
243, Capn Cook? Thats not you? Like I said no one is looking for you.,Walter,1
244, Did you learn nothing from my chemistry class?,Walter,1
245, Tell you what?,Walter,1
246, Tuco? no man ... no more Taco... I got bills man.,Jesse,5
247, Oh we are dead. Dead men! Muerto or muerte or however the hell you...Jesus...,Hank,4
248, What?,Hank,4
249, Man cmon!,Hank,3
250, Alright fine facts in. Fact A my phone rang like eight times last night. Dead air hang-ups every time. Second fact? Like three in the morning I saw that black Caddy of his cruising my neighborhood. No headlights.,Hank,2
251, Whos this Jesse Pinkman to you?,Skyler,1
252, I woke up. I found her. Thats all I know.,Jesse,5
253, Jeez.,Jesse,1
254, Yeah no shit. Thanks for noticing.,Skyler,1
255, I told you not to change the channel Man!,Jesse,2
256, Well were set. Boys are ready. Gonna make some mad cheddar yo. [Walter looks at Jesse] Cheddar Mr. White. Fat stacks. Dead Presidents. Cash money. Were gonna own this city.,Jesse,5
257, How significant?,Hank,2
258, Thats Backwardo. Oh wait no actually I changed it to Rewindo. Anyways he goes backwards. He can make everything go in reverse.,Hank,3
259, So youre going to what? Snort meth off a bowie knife? Youre gonna beat your homies to death when they dis you?,Walter,5
260,,Walter,3
261, And–and–and bring me... brake pads! The front wheels should have discs. Take them off and bring them to me.,Walter,2
262, Yo its me. Is this a good time?,Hank,3
263, Thats Backwardo. Oh wait no actually I changed it to Rewindo. Anyways he goes backwards. He can make everything go in reverse.,Hank,5
264, The game has changed yo. This is our city alright? All of it. The whole damn place. Our territory. Were staking our claim. Yo we sell when we want where we want. Were gonna be kings understand? Well Im gonna be king and you guys will be like princes or dukes or something.,Hank,5
265, You know what? Screw this. Im walking. You can come or not. Wheres my other shoe?,Jesse,2
266, Alright I will admit to a bit of a learning curve.,Walter,2
267, So you do have a plan! Yeah Mr. White! Yeah science!,Hank,1
268, You could charge twice the current rate for what I provide and your customers would pay it hands down. Now who I choose to do business with on my end is not your problem. You wont see him you wont interact with him. Forget he exists.,Walter,5
269, How much?,Jesse,5
270,,Walter,1
271, This is conjecture?,Hank,3
272, You know what I think? I think you accidentally told the truth.,Skyler,3
273, Its a whole lot of cheddar.,Hank,4
274, I woke up. I found her. Thats all I know.,Hank,5
275, So whats this stuff called again?,Jesse,1
276, I know but theres a problem.,Jesse,5
277, I got profile now yo. Dont you get that? DEAs up my ass. [takes a sip of his beer] No Im not exposing myself to that level of risk for chump change. - No way.,Jesse,5
278, Are you actually this stupid...,Walter,3
279, Tuco? no man ... no more Taco... I got bills man.,Jesse,2
280, Whatever it is Im afraid to know.,Skyler,2
281, Nobody.,Jesse,5
282, Smoking marijuana eating Cheetos and masturbating do not constitute plans in my book.,Walter,2
283, Tuco cmon hey hes theres clearly some dementia. Hes not lucid.,Walter,3
284, I got profile now yo. Dont you get that? DEAs up my ass. [takes a sip of his beer] No Im not exposing myself to that level of risk for chump change. - No way.,Jesse,4
285, You dont know. You know why you dont know? Because you dont think! Thats why! You dont think! You never figured out how to think did you big man?,Walter,5
286, Oh I know. I know youre not. Cause I asked her. It really took me forever to get in touch with her. She was ducking my calls for weeks. So I finally left a message What exactly is going on between you and my husband? I thought thatd get her attention and it did. So she called me back and she finally told me. The money? For your treatment? Gretchen and Elliott didnt give you a dime. They paid for nothing. You refused every offer they made you but that didnt make sense because I checked with Delcavoli in the hospital and not including your surgery were nearly paid up. Over $100000. Out of where? Out of thin air? But then I called your mother. Yeah. Thanks for that too. But I thought yknow maybe she has some money that I dont know about? Maybe she contributed? Its possible. It turns out that not only is the money not your mother she didnt even know that you have cancer. You never went to see her. I dropped you at the airport I picked you up you were gone for four days and yet she swears that you were never there. Lies on top of lies on top of lies.,Skyler,3
287, The soul? Theres nothing but chemistry here.,Walter,1
288, You still wanna cook? Seriously?,Jesse,3
